[
  {
    "id": "a-plus",
    "name": "CompTIA A+",
    "provider": "CompTIA",
    "pathCategory": "foundation",
    "displayOrder": 1,
    "status": "in-pursuit",
    "progress": null,
    "studyStartDate": null,
    "examDate": null,
    "earnedDate": null,
    "expirationDate": null,
    "skills": [],
    "verificationUrl": "",
    "credentialImageUrl": "",
    "githubUrl": "",
    "publicNotes": "",
    "updatedAt": "2026-08-01"
  },
  {
    "id": "network-plus",
    "name": "CompTIA Network+",
    "provider": "CompTIA",
    "pathCategory": "foundation",
    "displayOrder": 2,
    "status": "in-pursuit",
    "progress": null,
    "studyStartDate": null,
    "examDate": null,
    "earnedDate": null,
    "expirationDate": null,
    "skills": [],
    "verificationUrl": "",
    "credentialImageUrl": "",
    "githubUrl": "",
    "publicNotes": "",
    "updatedAt": "2026-08-01"
  },
  {
    "id": "linux-plus",
    "name": "CompTIA Linux+",
    "provider": "CompTIA",
    "pathCategory": "foundation",
    "displayOrder": 3,
    "status": "in-pursuit",
    "progress": null,
    "studyStartDate": null,
    "examDate": null,
    "earnedDate": null,
    "expirationDate": null,
    "skills": [],
    "verificationUrl": "",
    "credentialImageUrl": "",
    "githubUrl": "",
    "publicNotes": "",
    "updatedAt": "2026-08-01"
  },
  {
    "id": "security-plus",
    "name": "CompTIA Security+",
    "provider": "CompTIA",
    "pathCategory": "foundation",
    "displayOrder": 4,
    "status": "in-pursuit",
    "progress": null,
    "studyStartDate": null,
    "examDate": null,
    "earnedDate": null,
    "expirationDate": null,
    "skills": [],
    "verificationUrl": "",
    "credentialImageUrl": "",
    "githubUrl": "",
    "publicNotes": "",
    "updatedAt": "2026-08-01"
  },
  {
    "id": "cysa-plus",
    "name": "CompTIA CySA+",
    "provider": "CompTIA",
    "pathCategory": "specialization",
    "displayOrder": 5,
    "status": "in-pursuit",
    "progress": null,
    "studyStartDate": null,
    "examDate": null,
    "earnedDate": null,
    "expirationDate": null,
    "skills": [],
    "verificationUrl": "",
    "credentialImageUrl": "",
    "githubUrl": "",
    "publicNotes": "",
    "updatedAt": "2026-08-01"
  },
  {
    "id": "pentest-plus",
    "name": "CompTIA PenTest+",
    "provider": "CompTIA",
    "pathCategory": "specialization",
    "displayOrder": 6,
    "status": "in-pursuit",
    "progress": null,
    "studyStartDate": null,
    "examDate": null,
    "earnedDate": null,
    "expirationDate": null,
    "skills": [],
    "verificationUrl": "",
    "credentialImageUrl": "",
    "githubUrl": "",
    "publicNotes": "",
    "updatedAt": "2026-08-01"
  },
  {
    "id": "securityx",
    "name": "CompTIA SecurityX",
    "provider": "CompTIA",
    "pathCategory": "advanced",
    "displayOrder": 7,
    "status": "in-pursuit",
    "progress": null,
    "studyStartDate": null,
    "examDate": null,
    "earnedDate": null,
    "expirationDate": null,
    "skills": [],
    "verificationUrl": "",
    "credentialImageUrl": "",
    "githubUrl": "",
    "publicNotes": "",
    "updatedAt": "2026-08-01"
  },
  {
    "id": "cloud-plus",
    "name": "CompTIA Cloud+",
    "provider": "CompTIA",
    "pathCategory": "support",
    "displayOrder": 8,
    "status": "in-pursuit",
    "progress": null,
    "studyStartDate": null,
    "examDate": null,
    "earnedDate": null,
    "expirationDate": null,
    "skills": [],
    "verificationUrl": "",
    "credentialImageUrl": "",
    "githubUrl": "",
    "publicNotes": "",
    "updatedAt": "2026-08-01"
  }
]
